ID,Title,Type,Year,Release Date,Rating,Genres,Source,Trailer URL,Poster URL,Description,Now Playing
tmdb-movie-1062722,Frankenstein,movie,2025,2025-10-17,7.7,"Drama, Fantasy, Horror",Netflix,https://www.youtube.com/watch?v=9WZllcEgWrM,https://image.tmdb.org/t/p/w500/g4JtvGlQO7DByTI6frUobqvSL3R.jpg,"Dr. Victor Frankenstein, a brilliant but egotistical scientist, brings a creature to life in a monstrous experiment that ultimately leads to the undoing of both the creator and his tragic creation.",
tmdb-tv-80240,The Queen of Flow,tv,2018,2018-06-12,8.0,Drama,Netflix,https://www.youtube.com/watch?v=sZjBH4cuO5k,https://image.tmdb.org/t/p/w500/fuVuDYrs8sxvEolnYr0wCSvtyTi.jpg,"After spending seventeen years in prison unfairly, a talented songwriter seeks revenge on the men who sank her and killed her family.",
tmdb-tv-62650,Chicago Med,tv,2015,2015-11-17,8.3,Drama,In Theatres,https://www.youtube.com/watch?v=U2NZ7G02e40,https://image.tmdb.org/t/p/w500/9eym662FRJJb9wdgCiDKPDciZzf.jpg,An emotional thrill ride through the day-to-day chaos of the city's most explosive hospital and the courageous team of doctors who hold it together. They will tackle unique new cases inspired by topic...,
tmdb-tv-90,Mayday,tv,2003,2003-09-03,8.2,"Documentary, Drama, Crime",In Theatres,https://www.youtube.com/watch?v=D1PRxyN3qf0,https://image.tmdb.org/t/p/w500/sUfJxQarDfBMgmJgsgJqmVP16UU.jpg,Major real-life air disasters are depicted in this series. Each episode features a detailed dramatized reconstruction of the incident based on cockpit voice recorders and air traffic control transcrip...,
tmdb-tv-226637,High Potential,tv,2024,2024-09-17,8.0,"Drama, Crime, Mystery",Disney+,https://www.youtube.com/watch?v=W6zbdYNg9Rs,https://image.tmdb.org/t/p/w500/xCtaUDBUP1iKqtoqpHfeH1T2pWF.jpg,"Morgan is a single mom with an exceptional mind, whose unconventional knack for solving crimes leads to an unusual and unstoppable partnership with a by-the-book seasoned detective.",
tmdb-tv-98123,The Daily Life of the Immortal King,tv,2020,2020-01-18,8.3,"Animation, Comedy, Action",In Theatres,https://www.youtube.com/watch?v=ugUm2Q0FNq8,https://image.tmdb.org/t/p/w500/7By0jV3kf9MVvv3X3K8u4mhRUwp.jpg,"As a cultivation genius who has achieved a new realm every two years since he was a year old, Wang Ling is a near-invincible existence with prowess far beyond his control. But now that he’s sixteen, h...",
tmdb-tv-281401,Finding Her Edge,tv,2026,2026-01-22,7.1,Drama,Netflix,https://www.youtube.com/watch?v=ppZ3qgtFOME,https://image.tmdb.org/t/p/w500/rundKWddXHke82ee8Sv9KJmuGhn.jpg,A former ice dancer returns to the rink with an exciting new partner while holding onto feelings for her old one — her first love.,
tmdb-movie-858024,Hamnet,movie,2025,2025-11-26,7.8,"Drama, Romance, History",In Theatres,https://www.youtube.com/watch?v=I06-qKLtxCk,https://image.tmdb.org/t/p/w500/61xMzN4h8iLk0hq6oUzr9Ts6GE9.jpg,"The powerful story of love and loss that inspired the creation of Shakespeare's timeless masterpiece, Hamlet.",
tmdb-movie-1315303,Primate,movie,2026,2026-01-01,6.6,"Horror, Thriller",In Theatres,https://www.youtube.com/watch?v=jElnR65Otoo,https://image.tmdb.org/t/p/w500/z97hrgI5wbGbZvSVkBfAeBnFKAg.jpg,"Lucy, a college student, along with her friends, spend their vacation at her family's home in Hawaii, which includes her pet chimpanzee, Ben. However, when Ben contracts rabies after being bitten by a...",Cineplex
tmdb-movie-1220564,The Secret Agent,movie,2025,2025-07-23,7.7,"Crime, Drama, Thriller",In Theatres,https://www.youtube.com/watch?v=9UfrzDKrhEc,https://image.tmdb.org/t/p/w500/iLE2YOmeboeTDC7GlOp1dzh1VFo.jpg,"Brazil, 1977. Marcelo, a technology expert in his early 40s, is on the run. Hoping to reunite with his son, he travels to Recife during Carnival but soon realizes that the city is not the safe haven h...",
tmdb-movie-911430,F1,movie,2025,2025-06-25,7.8,"Action, Drama",Apple TV+,https://www.youtube.com/watch?v=yQhnhH2adFM,https://image.tmdb.org/t/p/w500/vqBmyAj0Xm9LnS1xe1MSlMAJyHq.jpg,Racing legend Sonny Hayes is coaxed out of retirement to lead a struggling Formula 1 team—and mentor a young hotshot driver—while chasing one more chance at glory.,
tmdb-movie-1208348,Rental Family,movie,2025,2025-11-20,7.8,"Comedy, Drama",In Theatres,https://www.youtube.com/watch?v=WcsoZYwhlxw,https://image.tmdb.org/t/p/w500/A5lswNlytTUrnMWsuD0NFfhZlf3.jpg,"An American actor in Tokyo struggles to find purpose until he lands an unusual gig: working for a Japanese 'rental family' agency, playing stand-in roles for strangers. As he immerses himself in his c...",
tmdb-tv-223530,Star Trek: Starfleet Academy,tv,2026,2026-01-15,5.0,Action,Paramount Plus,https://www.youtube.com/watch?v=rHDDzcyNWGs,https://image.tmdb.org/t/p/w500/m4JnADIJkF5ck6jq7GUEcPBKxd0.jpg,"A young group of cadets come together to pursue a common dream of hope and optimism. Under the watchful and demanding eyes of their instructors, they will discover what it takes to become Starfleet of...",
tmdb-movie-639988,No Other Choice,movie,2025,2025-12-25,7.7,"Crime, Thriller, Comedy",In Theatres,https://www.youtube.com/watch?v=qdW-NLafWOA,https://image.tmdb.org/t/p/w500/zqxc2O6eOcPdkcmvem9kgGHvkmM.jpg,"After being laid off and humiliated by a ruthless job market, a veteran paper mill manager descends into violence in a desperate bid to reclaim his dignity.",Cineplex
tmdb-tv-61859,The Night Manager,tv,2016,2016-02-21,7.7,"Drama, Mystery, Crime",In Theatres,https://www.youtube.com/watch?v=ZoJ3lu03jug,https://image.tmdb.org/t/p/w500/1MccRnw41qQjREuZkovqP2UX1i3.jpg,Former British soldier Jonathan Pine navigates the shadowy recesses of Whitehall and Washington where an unholy alliance operates between the intelligence community and the secret arms trade. To infil...,
tmdb-movie-701387,Bugonia,movie,2025,2025-10-23,7.4,"Sci-Fi, Thriller, Comedy",In Theatres,https://www.youtube.com/watch?v=gZ6pPFK6kaQ,https://image.tmdb.org/t/p/w500/rSdOua3wKMEaFWDcKAYWRjXQWOt.jpg,"Two conspiracy obsessed young men kidnap the high-powered CEO of a major company, convinced that she is an alien intent on destroying planet Earth.",
tmdb-tv-136311,Shrinking,tv,2023,2023-01-26,7.8,"Drama, Comedy",Apple TV+,https://www.youtube.com/watch?v=YjHfjQDWl1A,https://image.tmdb.org/t/p/w500/zEFKMNPBKq6JG7uuDkzTQ9WwErn.jpg,"Jimmy is struggling to grieve the loss of his wife while being a dad, friend, and therapist. He decides to try a new approach with everyone in his path: unfiltered, brutal honesty. Will it make things...",
tmdb-movie-1246049,Dracula,movie,2026,2026-02-06,7.2,"Horror, Fantasy, Romance",In Theatres,https://www.youtube.com/watch?v=hverb7siYJ8,https://image.tmdb.org/t/p/w500/ykyRfv7JDofLxXLAwtLXaSuaFfM.jpg,"When a 15th-century prince denounces God after the devastating loss of his wife, he inherits an eternal curse: he becomes Dracula. Condemned to wander the centuries, he defies fate and death itself, g...",
tmdb-tv-198102,Hijack,tv,2023,2023-06-28,7.6,Drama,Apple TV+,https://www.youtube.com/watch?v=WxwKzsklvJo,https://image.tmdb.org/t/p/w500/2C51clnxQdiqPDeqQlXcUx70hse.jpg,Expert negotiator Sam Nelson is in for the ride of his life—and so is everyone on board with him—after a group of hijackers take control. Sam will try every move in his playbook to take them down...as...,
tmdb-tv-225171,Pluribus,tv,2025,2025-11-06,7.9,Drama,Apple TV+,https://www.youtube.com/watch?v=a6lzvWby9UE,https://image.tmdb.org/t/p/w500/nrM2xFUfKJJEmZzd5d7kohT2G0C.jpg,The most miserable person on Earth must save the world from happiness.,
tmdb-tv-249907,Sentenced to Be a Hero,tv,2026,2026-01-03,9.0,"Animation, Action",In Theatres,https://www.youtube.com/watch?v=B5qZX2kh-7w,https://image.tmdb.org/t/p/w500/k8bh5mvHDx3czHSF56v9lRyulLC.jpg,"In a world where heroism is a punishment, Xylo Forbartz, a condemned goddess killer, battles endless hordes of monstrous abominations as part of Penal Hero Unit 9004. Death is no escape, only a cycle ...",
tmdb-tv-203737,【OSHI NO KO】,tv,2023,2023-04-12,8.3,"Animation, Drama",In Theatres,https://www.youtube.com/watch?v=FQLfj75E2JI,https://image.tmdb.org/t/p/w500/rFp74PFpz14AHrtlVPrLyrSng47.jpg,A small-town doctor gets sucked into the ruthless world of show business when he crosses paths with a popular teen idol who holds a secret.,
tmdb-movie-120,The Lord of the Rings: The Fellowship of the Ring,movie,2001,2001-12-19,8.4,"Adventure, Fantasy, Action",In Theatres,https://www.youtube.com/watch?v=CbYmZOV3G-Q,https://image.tmdb.org/t/p/w500/6oom5QYQ2yQTMJIbnvbkBL9cHo6.jpg,"Young hobbit Frodo Baggins, after inheriting a mysterious ring from his uncle Bilbo, must leave his home in order to keep it from falling into the hands of its evil creator. Along the way, a fellowshi...",Cineplex
tmdb-movie-1151272,Sirāt,movie,2025,2025-06-06,6.8,"Drama, Thriller, Music",In Theatres,https://www.youtube.com/watch?v=3_9OkHX8ZiA,https://image.tmdb.org/t/p/w500/bzBtsLi17rK4G6kDvOXfUZfAhca.jpg,"A man and his son arrive at a rave lost in the mountains of Morocco. They are looking for Marina, their daughter and sister, who disappeared months ago at another rave. Driven by fate, they decide to ...",
tmdb-movie-1124566,Sentimental Value,movie,2025,2025-08-20,7.6,Drama,In Theatres,https://www.youtube.com/watch?v=zBFstFXdk90,https://image.tmdb.org/t/p/w500/pz9NCWxxOk3o0W3v1Zkhawrwb4i.jpg,"Sisters Nora and Agnes reunite with their estranged father, the charismatic Gustav, a once-renowned director who offers stage actress Nora a role in what he hopes will be his comeback film. When Nora ...",
tmdb-tv-291339,Memory of a Killer,tv,2026,2026-01-25,8.2,Crime,Hulu,https://www.youtube.com/watch?v=TdenhFzKenM,https://image.tmdb.org/t/p/w500/3kpXrWW6gmlngwgSa52IhBpjPuz.jpg,"Angelo Ledda lives two totally separate lives — fearsome NYC hitman and sleepy upstate Cooperstown photocopier salesman and father. Both of them are threatened when he is diagnosed with Alzheimer's, a...",
tmdb-movie-1290821,Shelter,movie,2026,2026-01-28,7.5,"Action, Crime, Thriller",In Theatres,https://www.youtube.com/watch?v=kCY4Y3Y8UpA,https://image.tmdb.org/t/p/w500/klvZs66SG19qmacdwxSRkdFQhQS.jpg,"A man living in self-imposed exile on a remote island rescues a young girl from a violent storm, setting off a chain of events that forces him out of seclusion to protect her from enemies tied to his ...",Cineplex
tmdb-movie-122,The Lord of the Rings: The Return of the King,movie,2003,2003-12-17,8.5,"Adventure, Fantasy, Action",In Theatres,https://www.youtube.com/watch?v=1zPLzpqjO4U,https://image.tmdb.org/t/p/w500/rCzpDGLbOoPwLjy3OAm5NUPOTrC.jpg,"As armies mass for a final battle that will decide the fate of the world--and powerful, ancient forces of Light and Dark compete to determine the outcome--one member of the Fellowship of the Ring is r...",Cineplex
tmdb-movie-1241983,Train Dreams,movie,2025,2025-11-05,7.3,Drama,Netflix,https://www.youtube.com/watch?v=6voWeM-xQ4Y,https://image.tmdb.org/t/p/w500/wfzYOVdafdbD1d3SxNqiBtV2Yhx.jpg,A logger leads a life of quiet grace as he experiences love and loss during an era of monumental change in early 20th-century America.,
tmdb-movie-121,The Lord of the Rings: The Two Towers,movie,2026,2026-01-17,8.4,"Adventure, Fantasy, Action",In Theatres,https://www.youtube.com/watch?v=HUkDW37WaI0,https://image.tmdb.org/t/p/w500/5VTN0pR8gcqV3EPUHHfMGnJYN9L.jpg,"Frodo Baggins and the other members of the Fellowship continue on their sacred quest to destroy the One Ring--but on separate paths. Their destinies lie at two towers--Orthanc Tower in Isengard, where...",Cineplex
tmdb-movie-1371185,Song Sung Blue,movie,2025,2025-12-25,7.5,"Drama, Music, Romance",In Theatres,https://www.youtube.com/watch?v=Hm12K_cuLWA,https://image.tmdb.org/t/p/w500/kQzDdxI0F5z16qo2vzDoqdVMl4O.jpg,"Based on a true story, two down-on-their-luck musicians form a joyous Neil Diamond tribute band, proving it's never too late to find love and follow your dreams.",Cineplex
tmdb-movie-801937,"Silent Night, Deadly Night",movie,2025,2025-12-11,5.9,"Horror, Thriller",In Theatres,https://www.youtube.com/watch?v=wIi7YOvQe7s,https://image.tmdb.org/t/p/w500/xCdSd7NnRdnL8DGLVhI95WhUNoi.jpg,"After witnessing his parents' brutal murder on Christmas Eve, Billy transforms into a Killer Santa, delivering a yearly spree of calculated, chilling violence. This year, his blood-soaked mission coll...",
tmdb-movie-1316092,"""Wuthering Heights""",movie,2026,2026-02-11,TBD,"Drama, Romance",In Theatres,https://www.youtube.com/watch?v=VaSo2ur9_7s,https://image.tmdb.org/t/p/w500/ywRO5dyE8RyyXJd6cvd69jLZeic.jpg,"Tragedy strikes when Heathcliff falls in love with Catherine Earnshaw, a woman from a wealthy family in 18th-century England.",
tmdb-movie-1297842,GOAT,movie,2026,2026-02-07,TBD,"Animation, Comedy, Family, Action",In Theatres,https://www.youtube.com/watch?v=CnBlvCfzGb8,https://image.tmdb.org/t/p/w500/oXIj3R3QxcQ9wkv9YBWouBNmnFZ.jpg,"Will, a small goat with big dreams, gets a once-in-a-lifetime shot to join the pros and play roarball – a high-intensity, co-ed, full-contact sport dominated by the fastest, fiercest animals in the wo...",
tmdb-movie-1116201,Iron Lung,movie,2026,2026-01-29,TBD,"Horror, Sci-Fi",In Theatres,https://www.youtube.com/watch?v=IaEtA56pd_w,https://image.tmdb.org/t/p/w500/sIwakdbMGS1krtgendTWpxTY9Hw.jpg,The stars are gone. The planets have disappeared. Only individuals aboard space stations or starships were left to give the end a name - The Quiet Rapture. After decades of decay and crumbling infrast...,Cineplex
tmdb-movie-696393,Cold Storage,movie,2026,2026-02-13,4.0,"Comedy, Sci-Fi, Thriller",In Theatres,https://www.youtube.com/watch?v=L9biJQ3rn_8,https://image.tmdb.org/t/p/w500/pfqkETJ2A3zXZJuNcufZbAJNnKA.jpg,"When a mutating, highly contagious fungus escapes a sealed facility, two young employees – joined by a grizzled bioterror operative – must survive the wildest night shift ever to save humanity from ex...",
tmdb-movie-1480382,The Voice of Hind Rajab,movie,2026,2026-01-23,8.2,Drama,In Theatres,https://www.youtube.com/watch?v=JkeKrG0YONQ,https://image.tmdb.org/t/p/w500/fBcBY8kdBiPsRdtkbldwg3ThlyJ.jpg,"January 29, 2024. Red Crescent volunteers receive an emergency call. A five-year old girl is trapped in a car under fire in Gaza, pleading for rescue. While trying to keep her on the line, they do eve...",Cineplex
tmdb-tv-218961,Drops of God,tv,2023,2023-04-21,7.6,"Drama, Mystery",Apple TV+,https://www.youtube.com/watch?v=3_y2j72Cfe4,https://image.tmdb.org/t/p/w500/t3OGrj5z0RSv7GaPxtcNneu2JCr.jpg,"While the world of wine mourns the death of Alexandre Léger, his estranged daughter, Camille, learns his extraordinary collection is now hers. But before she can claim her inheritance, Camille must be...",
tmdb-movie-1159559,Scream 7,movie,2026,2026-02-25,TBD,"Horror, Mystery, Crime",In Theatres,https://www.youtube.com/watch?v=kFdDOLP5mXY,https://image.tmdb.org/t/p/w500/jjyuk0edLiW8vOSnlfwWCCLpbh5.jpg,"When a new Ghostface killer emerges in the quiet town where Sidney Prescott has built a new life, her darkest fears are realized as her daughter becomes the next target. Determined to protect her fami...",
tmdb-movie-1379266,Kokuho,movie,2026,2026-02-06,8.2,Drama,In Theatres,https://www.youtube.com/watch?v=Y0KfXj3Skao,https://image.tmdb.org/t/p/w500/a15F5KJ4mleusJR1YKP4zUyZaxG.jpg,"Nagasaki, 1964: Following the death of his yakuza father, 15-year-old Kikuo is taken under the wing of a famous kabuki actor. Alongside Shunsuke, the actor’s only son, he decides to dedicate himself t...",
tmdb-movie-1413097,Melania,movie,2026,2026-01-30,3.0,Documentary,In Theatres,https://www.youtube.com/watch?v=dxXJAqOU00g,https://image.tmdb.org/t/p/w500/ba6Silct0Y4pyvrSv0Tj0Urmx9f.jpg,Offering unprecedented access to the 20 days leading up to the 2025 Presidential Inauguration — through the eyes of the First Lady-elect herself — step inside Melania Trump's world as she orchestrates...,Cineplex
tmdb-movie-1262815,The Choral,movie,2026,2026-01-09,6.6,"Comedy, Drama, Music",In Theatres,https://www.youtube.com/watch?v=6zRVP-ZgMm8,https://image.tmdb.org/t/p/w500/yQtms7CSM0CE0W6dYbLLAATb5rL.jpg,"As World War I rages on, Dr. Henry Guthrie takes over a British choral society that's lost most of its men to the army. The community soon discovers that the best response to the chaos of war is to ma...",Cineplex
tmdb-movie-1171145,Crime 101,movie,2026,2026-02-12,TBD,"Crime, Thriller",In Theatres,https://www.youtube.com/watch?v=KeEHsuZ4Ja4,https://image.tmdb.org/t/p/w500/fDj8ZATOTmiFy7BF43L3XLIOrf0.jpg,"When an elusive thief whose high-stakes heists unfold along the iconic 101 freeway in Los Angeles eyes the score of a lifetime, with hopes of this being his final job, his path collides with a disillu...",
tmdb-movie-1159206,Father Mother Sister Brother,movie,2026,2026-01-10,6.7,"Comedy, Drama",In Theatres,https://www.youtube.com/watch?v=PA07EmbZ0b0,https://image.tmdb.org/t/p/w500/zewZA6sL52YSH8xIH4wbG5GadjV.jpg,"Three stories concerning the relationships between adult children, their somewhat distant parent (or parents), and each other: a reclusive father visited by his grown children in the US, sisters visit...",Cineplex
tmdb-movie-1202549,The Well,movie,2026,2026-01-23,TBD,"Drama, Thriller",In Theatres,https://www.youtube.com/watch?v=IsGm5UAJMs4,https://image.tmdb.org/t/p/w500/4LaC3a1ZMrIBXsDGaPFHaa2mzCI.jpg,"In a world where environmental collapse has left survivors to fight for the precious resources needed to survive, a young woman’s loyalties are tested by the arrival of a wounded man. When he discover...",Cineplex
tmdb-movie-1198984,We Bury the Dead,movie,2026,2026-01-02,6.4,"Horror, Thriller, Sci-Fi, Drama",In Theatres,https://www.youtube.com/watch?v=iE-W-wEJJqw,https://image.tmdb.org/t/p/w500/vWOALCjS3cANciJKkG0qV8k1izW.jpg,"After a catastrophic military disaster, the dead don't just rise—they hunt. The military insists they are harmless and slow-moving, offering hope to grieving families. But when Ava enters a quarantine...",Cineplex
tmdb-movie-1510688,Call Me Mother,movie,2026,2026-01-09,8.0,"Comedy, Drama",In Theatres,https://www.youtube.com/watch?v=cFZmGrP108E,https://image.tmdb.org/t/p/w500/p0umaKN4HpuA8ynXNofbOuhz7ON.jpg,"Twinkle is a single queer mother whose dream of officially adopting her son gets shaken when the boy's biological mother, Mara, unexpectedly reappears.",Cineplex
tmdb-movie-1193501,Whistle,movie,2026,2026-02-06,2.0,"Horror, Mystery",In Theatres,https://www.youtube.com/watch?v=K784dJXVhBo,https://image.tmdb.org/t/p/w500/ieOiiCBbf0SNwR39iiA2xnGOnab.jpg,"When a group of misfit teenagers stumble upon an ancient Aztec death whistle, they learn that by blowing it, its terrifying sound will invoke their future deaths to hunt them down. As the body count r...",
tmdb-movie-1154538,Nirvanna the Band the Show the Movie,movie,2026,2026-02-13,TBD,"Comedy, Sci-Fi, Adventure",In Theatres,https://www.youtube.com/watch?v=y2K9ccMREOI,https://image.tmdb.org/t/p/w500/sm5TGX8WbnCd9Uo26cLyTxVwA1n.jpg,"When their plan to book a show at the Rivoli goes horribly wrong, Matt and Jay accidentally travel back to the year 2008.",
tmdb-movie-870360,The Day the Earth Blew Up: A Looney Tunes Movie,movie,2025,2025-03-14,7.6,"Family, Comedy, Adventure, Animation, Sci-Fi",In Theatres,https://www.youtube.com/watch?v=rfavar8cEPs,https://image.tmdb.org/t/p/w500/s2lB1kaYCdGSnZX5meQCiOR6HfX.jpg,"Porky and Daffy, the classic animated odd couple, turn into unlikely heroes when their antics at the local bubble gum factory uncover a secret alien mind control plot. Against all odds, the two are de...",Cineplex
tmdb-movie-1429348,The Stranger,movie,2026,2026-01-16,6.8,"Drama, Crime",In Theatres,https://www.youtube.com/watch?v=gR912kHSOlA,https://image.tmdb.org/t/p/w500/11lx7Isd86SIPeNuWlAPjYTfr57.jpg,"In 1930s Algeria, the daily life of an indifferent Frenchman is shaken by the death of his mother and a fateful encounter on a beach.",Cineplex
tmdb-movie-1395140,Lupin the IIIRD: The Movie - The Immortal Bloodline,movie,2026,2026-01-09,8.0,"Animation, Action, Crime",In Theatres,https://www.youtube.com/watch?v=_xHWDNnU7ps,https://image.tmdb.org/t/p/w500/oqipJVMlnXeDakXtINMeIAl341q.jpg,"After fending off a series of skilled assassins, gentleman thief Lupin III and his band of allies follow a strange invitation to an uncharted island. When their plane is shot down, the gang is strande...",Cineplex
tmdb-movie-1305715,Unexpected Family,movie,2026,2026-02-06,7.3,"Comedy, Drama",In Theatres,https://www.youtube.com/watch?v=qo_ci3zwRVw,https://image.tmdb.org/t/p/w500/jTuu8wLW2RUg1IzX4IC7wqpsjIo.jpg,"For family reasons, Zhong Bufan, a young man from a small town, flees his home to try to reach Beijing. On the way, he crosses paths with Ren Jiqing, an old man suffering from Alzheimer's disease who ...",
tmdb-movie-1128547,Islands,movie,2026,2026-01-30,6.2,"Thriller, Drama, Crime",In Theatres,https://www.youtube.com/watch?v=MifpmLyraBE,https://image.tmdb.org/t/p/w500/a5CewSvoMsfAdg093AKzovKfVHd.jpg,"In this twisty thriller, a tennis coach at a tropical resort finds himself at the center of a missing persons mystery. Tom teaches tennis during the day and parties at night. When an enigmatic tourist...",Cineplex
tmdb-movie-959646,Zombie Land Saga: Yumeginga Paradise,movie,2026,2026-01-19,TBD,"Animation, Comedy, Music, Action",In Theatres,https://www.youtube.com/watch?v=G1nG-AKY7Yk,https://image.tmdb.org/t/p/w500/a4xxEU8MQLaVeduHUe3nn7m5iXd.jpg,"Zombies × Idols × Saga — Seriously!? What kind of madness will this outrageous, expectation-defying anime unleash on the big screen!? Legendary girls return as zombies to fight as Saga's local idols i...",Cineplex
tmdb-movie-467905,How to Make a Killing,movie,2026,2026-02-20,TBD,"Comedy, Thriller, Drama",In Theatres,https://www.youtube.com/watch?v=B7RslMKZ2Yc,https://image.tmdb.org/t/p/w500/yQ7OP2HYxl9YmkWNMkuUA2YaF5.jpg,"Disowned at birth by his obscenely wealthy family, blue-collar Becket Redfellow will stop at nothing to reclaim his inheritance, no matter how many relatives stand in his way.",
tmdb-movie-1537690,Busted Water Pipes,movie,2026,2026-01-30,TBD,"Comedy, Crime",In Theatres,https://www.youtube.com/watch?v=YJizr6Sgri4,https://image.tmdb.org/t/p/w500/kDsSmwtX8N0wmxRRdxjgYHenFNe.jpg,"A crime-fighting cop maintains a zero-crime rate and faces job loss, so he decides to fabricate a major case, unaware that actual grave robbers are targeting a treasure-filled tomb located directly be...",Cineplex
tmdb-movie-1339173,Honey Bunch,movie,2026,2026-01-23,TBD,"Drama, Thriller",In Theatres,https://www.youtube.com/watch?v=7bG6ymmZM7s,https://image.tmdb.org/t/p/w500/rR6zS2sPpcjND92cCLmsuMNok7M.jpg,"Diana's husband is taking her to an experimental trauma facility deep in the wilderness, but she can't remember why... As her memories begin to creep back in so do some unwelcome sinister truths about...",Cineplex
tmdb-movie-1263012,Dead Man's Wire,movie,2026,2026-01-16,6.3,"Crime, Drama",In Theatres,https://www.youtube.com/watch?v=0dTPOrJXqOw,https://image.tmdb.org/t/p/w500/71FPde8V7DbnAHgUZfwrpxPOFG6.jpg,"In 1977, former real estate developer Tony Kiritsis puts a dead man's switch on himself and the mortgage banker who did him wrong, demanding $5 million and a personal apology.",Cineplex
tmdb-movie-766520,Rosemead,movie,2026,2026-01-09,7.0,Drama,In Theatres,https://www.youtube.com/watch?v=IwQy6jV1QCM,https://image.tmdb.org/t/p/w500/uVilyfKrB5ZkhXh7MMaIaevzueR.jpg,"In a race against time, an ailing woman discovers her teenage son's violent obsessions and must go to great lengths to protect him, and possibly others, in this portrait of a Chinese American family. ...",Cineplex
tmdb-movie-524635,The Chronology of Water,movie,2026,2026-01-16,6.9,Drama,In Theatres,https://www.youtube.com/watch?v=OycsHnfoVz0,https://image.tmdb.org/t/p/w500/a0myciW2wnVBOB1fnHLUOVgX0fD.jpg,"Growing up in an environment torn apart by violence and alcohol, a young woman finds her voice through the written word and her salvation as a swimmer.",Cineplex
tmdb-movie-1403189,Follies,movie,2026,2026-01-30,TBD,"Comedy, Romance",In Theatres,https://www.youtube.com/watch?v=w1ZfKWzpTt4,https://image.tmdb.org/t/p/w500/8gPI34eVTkBXLXDFBQJbDeAOvsP.jpg,"François and Julie, together for 16 years and parents of two children, can no longer connect intimately. They decide to open up their relationship in order to engage in sexual follies that will allow ...",Cineplex
tmdb-movie-1422562,The Moment,movie,2026,2026-02-06,4.0,"Drama, Comedy, Music",In Theatres,https://www.youtube.com/watch?v=2oiLhpZp7sY,https://image.tmdb.org/t/p/w500/txnHhq3GA1zDxZQMk2igq9CyA8v.jpg,"A rising pop sensation navigates fame and industry pressures while preparing for her arena tour debut, revealing the transformation of underground culture into mainstream success.",
tmdb-movie-1445363,EPiC: Elvis Presley in Concert,movie,2026,2026-02-20,TBD,"Music, Documentary",In Theatres,https://www.youtube.com/watch?v=2s_dCvUgOBI,https://image.tmdb.org/t/p/w500/433YxgwVpX8sUPbqzjTAQjLkPX0.jpg,"A mix of a documentary and concert film made using unused footage from Elvis: That's the Way It Is, the film of Elvis' legendary 1970 Summer Festival in Las Vegas and Elvis's road concert film from tw...",
tmdb-movie-1276521,Charlie the Wonderdog,movie,2026,2026-01-16,TBD,"Action, Animation, Adventure, Comedy",In Theatres,https://www.youtube.com/watch?v=uUDfO0Q4sog,https://image.tmdb.org/t/p/w500/whvkL0wzxgKmVbaPontq9NlVd5z.jpg,"Timid nine year old Danny teams up with his beloved family dog Charlie, who gets abducted by aliens and returns with superpowers, to thwart a plan by the neighbor's sinister cat Puddy to destroy human...",Cineplex
